{
  "id": "wedding-starry-010",
  "name": "Starry Night",
  "scene": "wedding",
  "style": "romantic",
  "description": "Original starry night artwork with editable wedding typography on a portrait 2:3 canvas.",
  "tags": [
    "stars",
    "night",
    "celestial",
    "cosmic",
    "romantic"
  ],
  "thumbnailUrl": "/templates/wedding-art/starry-night-thumbnail.webp",
  "previewUrl": "/templates/wedding-art/starry-night-preview.webp",
  "canvas": {
    "width": 750,
    "height": 1125,
    "background": {
      "type": "image",
      "url": "/templates/wedding-art/starry-night.webp",
      "fit": "contain"
    }
  },
  "layers": [
    {
      "id": "invitation-heading",
      "type": "text",
      "name": "Invitation heading",
      "position": {
        "x": 140,
        "y": 230
      },
      "size": {
        "width": 470,
        "height": 36
      },
      "zIndex": 2,
      "content": {
        "text": "Written in the stars",
        "font": {
          "family": "Cormorant Garamond",
          "size": 25,
          "weight": 400,
          "lineHeight": 1.2
        },
        "color": "#d6c59d",
        "align": "center"
      }
    },
    {
      "id": "couple-names",
      "type": "text",
      "name": "Couple Names",
      "position": {
        "x": 140,
        "y": 292
      },
      "size": {
        "width": 470,
        "height": 290
      },
      "zIndex": 2,
      "variable": "couple_names",
      "content": {
        "text": "Luna\n&\nOrion",
        "font": {
          "family": "Cormorant Garamond",
          "size": 74,
          "weight": 400,
          "lineHeight": 1.2
        },
        "color": "#f0e9d7",
        "align": "center"
      }
    },
    {
      "id": "date-venue",
      "type": "text",
      "name": "Date and Location",
      "position": {
        "x": 140,
        "y": 610
      },
      "size": {
        "width": 470,
        "height": 100
      },
      "zIndex": 2,
      "variable": "event_details",
      "content": {
        "text": "November 11, 2026\nStarlight Observatory",
        "font": {
          "family": "Manrope",
          "size": 19,
          "weight": 400,
          "lineHeight": 1.2
        },
        "color": "#f0e9d7",
        "align": "center"
      }
    },
    {
      "id": "fine-rule",
      "type": "shape",
      "name": "Fine divider",
      "position": {
        "x": 345,
        "y": 723
      },
      "size": {
        "width": 60,
        "height": 1
      },
      "zIndex": 1,
      "content": {
        "shape": "rectangle",
        "fill": "#d6c59d"
      }
    },
    {
      "id": "invitation-text",
      "type": "text",
      "name": "Invitation Message",
      "position": {
        "x": 140,
        "y": 750
      },
      "size": {
        "width": 470,
        "height": 100
      },
      "zIndex": 2,
      "variable": "message",
      "content": {
        "text": "Under a sky full of stars,\njoin us as we begin our forever.",
        "font": {
          "family": "Cormorant Garamond",
          "size": 23,
          "weight": 400,
          "lineHeight": 1.2
        },
        "color": "#f0e9d7",
        "align": "center"
      }
    }
  ],
  "variables": [
    {
      "key": "couple_names",
      "type": "text",
      "label": "Couple Names",
      "defaultValue": "Luna\n&\nOrion",
      "validation": {
        "required": true,
        "maxLength": 50
      }
    },
    {
      "key": "event_details",
      "type": "text",
      "label": "Date and Venue",
      "defaultValue": "November 11, 2026\nStarlight Observatory",
      "validation": {
        "required": true
      }
    },
    {
      "key": "message",
      "type": "text",
      "label": "Invitation Message",
      "defaultValue": "Under a sky full of stars,\njoin us as we begin our forever.",
      "aiGenerable": true
    }
  ],
  "colorSchemes": [
    {
      "id": "starry-night",
      "name": "Starry Night",
      "colors": {
        "primary": "#d6c59d",
        "secondary": "#f0e9d7",
        "accent": "#d6c59d",
        "text": "#f0e9d7"
      }
    }
  ],
  "settings": {
    "allowMusic": true,
    "allowAnimation": true,
    "rsvpEnabled": true
  }
}
