{
  "id": "3c8b3e51-9a1a-4d42-bd12-fd75a4a5d102",
  "name": "Make a wish",
  "scene": "birthday",
  "style": "playful",
  "description": "A bright, celebratory invitation with a little movement and lots of color.",
  "tags": ["colorful", "playful", "party", "animated"],
  "thumbnailUrl": "/templates/birthday-playful/thumbnail.svg",
  "previewUrl": "/templates/birthday-playful/preview.svg",
  "canvas": {
    "width": 750,
    "height": 1334,
    "background": {
      "type": "html",
      "html": "<div class=\"confetti\" aria-hidden=\"true\"></div>",
      "css": ".confetti { background: radial-gradient(circle at 15% 20%, #ff6b9d 0 5%, transparent 6%), radial-gradient(circle at 80% 15%, #6c63ff 0 5%, transparent 6%), radial-gradient(circle at 65% 78%, #00b894 0 5%, transparent 6%), linear-gradient(135deg, #fff4d6, #f4e5ff); background-size: 140px 140px, 190px 190px, 170px 170px, auto; animation: float 8s linear infinite; } @keyframes float { to { background-position: 0 140px, 190px 0, -170px 170px, 0 0; } }"
    }
  },
  "layers": [
    { "id": "eyebrow", "type": "text", "name": "Eyebrow", "position": { "x": 90, "y": 180 }, "size": { "width": 570, "height": 50 }, "content": { "text": "COME CELEBRATE", "font": { "family": "Inter", "size": 18, "weight": 700, "letterSpacing": 4 }, "color": "#6c63ff", "align": "center" }, "zIndex": 2 },
    { "id": "title", "type": "text", "name": "Birthday title", "position": { "x": 65, "y": 320 }, "size": { "width": 620, "height": 180 }, "variable": "birthday_title", "content": { "text": "Happy Birthday!", "font": { "family": "Inter", "size": 64, "weight": 700, "lineHeight": 1.05 }, "color": "#241b4b", "align": "center", "maxWidth": 620 }, "zIndex": 2 },
    { "id": "name", "type": "text", "name": "Birthday person", "position": { "x": 80, "y": 570 }, "size": { "width": 590, "height": 100 }, "variable": "birthday_person", "content": { "text": "Jordan's 30th", "font": { "family": "Inter", "size": 34, "weight": 600 }, "color": "#ff6b9d", "align": "center" }, "zIndex": 2 },
    { "id": "details", "type": "text", "name": "Date and place", "position": { "x": 100, "y": 760 }, "size": { "width": 550, "height": 130 }, "variable": "event_details", "content": { "text": "Saturday, 22 August 2026\nThe Terrace, Brighton", "font": { "family": "Inter", "size": 23, "weight": 500, "lineHeight": 1.6 }, "color": "#241b4b", "align": "center", "maxWidth": 550 }, "zIndex": 2 },
    { "id": "footer", "type": "text", "name": "Footer note", "position": { "x": 100, "y": 1080 }, "size": { "width": 550, "height": 100 }, "variable": "rsvp_note", "content": { "text": "Cake, music, and a dance floor. RSVP by 1 August.", "font": { "family": "Inter", "size": 18, "weight": 400, "lineHeight": 1.5 }, "color": "#514b70", "align": "center", "maxWidth": 550 }, "zIndex": 2 }
  ],
  "variables": [
    { "key": "birthday_title", "type": "text", "label": "Title", "defaultValue": "Happy Birthday!", "validation": { "required": true, "maxLength": 40 }, "aiGenerable": true },
    { "key": "birthday_person", "type": "text", "label": "Name and age", "defaultValue": "", "validation": { "required": true, "maxLength": 50 } },
    { "key": "event_details", "type": "date", "label": "Date and location", "defaultValue": "", "validation": { "required": true } },
    { "key": "rsvp_note", "type": "text", "label": "RSVP note", "defaultValue": "" }
  ],
  "colorSchemes": [
    { "id": "rainbow", "name": "Rainbow", "colors": { "primary": "#6c63ff", "secondary": "#ff6b9d", "accent": "#ffe08a", "text": "#241b4b", "background": "#fff4d6" } },
    { "id": "blue-pink", "name": "Blue and pink", "colors": { "primary": "#1982c4", "secondary": "#ff6b9d", "accent": "#d9f0ff", "text": "#17324d", "background": "#f5fbff" } },
    { "id": "violet-orange", "name": "Violet and orange", "colors": { "primary": "#6c63ff", "secondary": "#f77f00", "accent": "#ffe6cc", "text": "#241b4b", "background": "#fbf7ff" } }
  ],
  "settings": { "allowMusic": true, "allowAnimation": true, "rsvpEnabled": true }
}
