{
  "id": "wedding-sunset-004",
  "name": "Golden Hour",
  "scene": "wedding",
  "style": "romantic",
  "description": "Original golden hour artwork with editable wedding typography on a portrait 2:3 canvas.",
  "tags": [
    "sunset",
    "golden",
    "warm",
    "romantic",
    "twilight"
  ],
  "thumbnailUrl": "/templates/wedding-art/golden-hour-thumbnail.webp",
  "previewUrl": "/templates/wedding-art/golden-hour-preview.webp",
  "canvas": {
    "width": 750,
    "height": 1125,
    "background": {
      "type": "image",
      "url": "/templates/wedding-art/golden-hour.webp",
      "fit": "contain"
    }
  },
  "layers": [
    {
      "id": "invitation-heading",
      "type": "text",
      "name": "Invitation heading",
      "position": {
        "x": 140,
        "y": 145
      },
      "size": {
        "width": 470,
        "height": 36
      },
      "zIndex": 2,
      "content": {
        "text": "A golden kind of forever",
        "font": {
          "family": "Cormorant Garamond",
          "size": 25,
          "weight": 400,
          "lineHeight": 1.2
        },
        "color": "#774028",
        "align": "center"
      }
    },
    {
      "id": "couple-names",
      "type": "text",
      "name": "Couple Names",
      "position": {
        "x": 140,
        "y": 207
      },
      "size": {
        "width": 470,
        "height": 290
      },
      "zIndex": 2,
      "variable": "couple_names",
      "content": {
        "text": "Emma\n&\nLucas",
        "font": {
          "family": "Cormorant Garamond",
          "size": 66,
          "weight": 400,
          "lineHeight": 1.2
        },
        "color": "#5b321e",
        "align": "center"
      }
    },
    {
      "id": "date-venue",
      "type": "text",
      "name": "Date and Location",
      "position": {
        "x": 140,
        "y": 470
      },
      "size": {
        "width": 470,
        "height": 100
      },
      "zIndex": 2,
      "variable": "event_details",
      "content": {
        "text": "August 8, 2026\nSunset Beach Resort",
        "font": {
          "family": "Manrope",
          "size": 19,
          "weight": 400,
          "lineHeight": 1.2
        },
        "color": "#5b321e",
        "align": "center"
      }
    },
    {
      "id": "fine-rule",
      "type": "shape",
      "name": "Fine divider",
      "position": {
        "x": 345,
        "y": 583
      },
      "size": {
        "width": 60,
        "height": 1
      },
      "zIndex": 1,
      "content": {
        "shape": "rectangle",
        "fill": "#774028"
      }
    },
    {
      "id": "invitation-text",
      "type": "text",
      "name": "Invitation Message",
      "position": {
        "x": 140,
        "y": 610
      },
      "size": {
        "width": 470,
        "height": 100
      },
      "zIndex": 2,
      "variable": "message",
      "content": {
        "text": "Join us as we begin our life together.",
        "font": {
          "family": "Cormorant Garamond",
          "size": 23,
          "weight": 400,
          "lineHeight": 1.2
        },
        "color": "#5b321e",
        "align": "center"
      }
    }
  ],
  "variables": [
    {
      "key": "couple_names",
      "type": "text",
      "label": "Couple Names",
      "defaultValue": "Emma\n&\nLucas",
      "validation": {
        "required": true,
        "maxLength": 50
      }
    },
    {
      "key": "event_details",
      "type": "text",
      "label": "Date and Venue",
      "defaultValue": "August 8, 2026\nSunset Beach Resort",
      "validation": {
        "required": true
      }
    },
    {
      "key": "message",
      "type": "text",
      "label": "Invitation Message",
      "defaultValue": "Join us as we begin our life together.",
      "aiGenerable": true
    }
  ],
  "colorSchemes": [
    {
      "id": "golden-hour",
      "name": "Golden Hour",
      "colors": {
        "primary": "#774028",
        "secondary": "#5b321e",
        "accent": "#774028",
        "text": "#5b321e"
      }
    }
  ],
  "settings": {
    "allowMusic": true,
    "allowAnimation": true,
    "rsvpEnabled": true
  }
}
