{
  "id": "wedding-vintage-006",
  "name": "Vintage Romance",
  "scene": "wedding",
  "style": "vintage",
  "description": "Original vintage romance artwork with editable wedding typography on a portrait 2:3 canvas.",
  "tags": [
    "vintage",
    "classic",
    "ornate",
    "retro",
    "elegant"
  ],
  "thumbnailUrl": "/templates/wedding-art/vintage-romance-thumbnail.webp",
  "previewUrl": "/templates/wedding-art/vintage-romance-preview.webp",
  "canvas": {
    "width": 750,
    "height": 1125,
    "background": {
      "type": "image",
      "url": "/templates/wedding-art/vintage-romance.webp",
      "fit": "contain"
    }
  },
  "layers": [
    {
      "id": "invitation-heading",
      "type": "text",
      "name": "Invitation heading",
      "position": {
        "x": 140,
        "y": 230
      },
      "size": {
        "width": 470,
        "height": 36
      },
      "zIndex": 2,
      "content": {
        "text": "Together with their families",
        "font": {
          "family": "Cormorant Garamond",
          "size": 25,
          "weight": 400,
          "lineHeight": 1.2
        },
        "color": "#725356",
        "align": "center"
      }
    },
    {
      "id": "couple-names",
      "type": "text",
      "name": "Couple Names",
      "position": {
        "x": 140,
        "y": 292
      },
      "size": {
        "width": 470,
        "height": 290
      },
      "zIndex": 2,
      "variable": "couple_names",
      "content": {
        "text": "Elizabeth\n&\nThomas",
        "font": {
          "family": "Cormorant Garamond",
          "size": 74,
          "weight": 400,
          "lineHeight": 1.2
        },
        "color": "#563d3e",
        "align": "center"
      }
    },
    {
      "id": "date-venue",
      "type": "text",
      "name": "Date and Location",
      "position": {
        "x": 140,
        "y": 610
      },
      "size": {
        "width": 470,
        "height": 100
      },
      "zIndex": 2,
      "variable": "event_details",
      "content": {
        "text": "The Twenty-Fifth of May\nTwo Thousand Twenty-Six\nVintage Estate Manor",
        "font": {
          "family": "Manrope",
          "size": 19,
          "weight": 400,
          "lineHeight": 1.2
        },
        "color": "#563d3e",
        "align": "center"
      }
    },
    {
      "id": "fine-rule",
      "type": "shape",
      "name": "Fine divider",
      "position": {
        "x": 345,
        "y": 723
      },
      "size": {
        "width": 60,
        "height": 1
      },
      "zIndex": 1,
      "content": {
        "shape": "rectangle",
        "fill": "#725356"
      }
    },
    {
      "id": "invitation-text",
      "type": "text",
      "name": "Invitation Message",
      "position": {
        "x": 140,
        "y": 750
      },
      "size": {
        "width": 470,
        "height": 100
      },
      "zIndex": 2,
      "variable": "message",
      "content": {
        "text": "Request the honour of your presence\nat the celebration of their marriage.",
        "font": {
          "family": "Cormorant Garamond",
          "size": 23,
          "weight": 400,
          "lineHeight": 1.2
        },
        "color": "#563d3e",
        "align": "center"
      }
    }
  ],
  "variables": [
    {
      "key": "couple_names",
      "type": "text",
      "label": "Couple Names",
      "defaultValue": "Elizabeth\n&\nThomas",
      "validation": {
        "required": true,
        "maxLength": 50
      }
    },
    {
      "key": "event_details",
      "type": "text",
      "label": "Date and Venue",
      "defaultValue": "The Twenty-Fifth of May\nTwo Thousand Twenty-Six\nVintage Estate Manor",
      "validation": {
        "required": true
      }
    },
    {
      "key": "message",
      "type": "text",
      "label": "Invitation Message",
      "defaultValue": "Request the honour of your presence\nat the celebration of their marriage.",
      "aiGenerable": true
    }
  ],
  "colorSchemes": [
    {
      "id": "vintage-romance",
      "name": "Vintage Romance",
      "colors": {
        "primary": "#725356",
        "secondary": "#563d3e",
        "accent": "#725356",
        "text": "#563d3e"
      }
    }
  ],
  "settings": {
    "allowMusic": true,
    "allowAnimation": true,
    "rsvpEnabled": true
  }
}
