{
  "id": "wedding-golden-008",
  "name": "Gilded Elegance",
  "scene": "wedding",
  "style": "luxury",
  "description": "Original gilded elegance artwork with editable wedding typography on a portrait 2:3 canvas.",
  "tags": [
    "baroque",
    "gold",
    "luxury",
    "ornate",
    "regal"
  ],
  "thumbnailUrl": "/templates/wedding-art/gilded-elegance-thumbnail.webp",
  "previewUrl": "/templates/wedding-art/gilded-elegance-preview.webp",
  "canvas": {
    "width": 750,
    "height": 1125,
    "background": {
      "type": "image",
      "url": "/templates/wedding-art/gilded-elegance.webp",
      "fit": "contain"
    }
  },
  "layers": [
    {
      "id": "invitation-heading",
      "type": "text",
      "name": "Invitation heading",
      "position": {
        "x": 140,
        "y": 230
      },
      "size": {
        "width": 470,
        "height": 36
      },
      "zIndex": 2,
      "content": {
        "text": "THE WEDDING OF",
        "font": {
          "family": "Manrope",
          "size": 15,
          "weight": 400,
          "lineHeight": 1.2
        },
        "color": "#816a34",
        "align": "center"
      }
    },
    {
      "id": "couple-names",
      "type": "text",
      "name": "Couple Names",
      "position": {
        "x": 140,
        "y": 292
      },
      "size": {
        "width": 470,
        "height": 290
      },
      "zIndex": 2,
      "variable": "couple_names",
      "content": {
        "text": "Isabella\n&\nMaximilian",
        "font": {
          "family": "Cormorant Garamond",
          "size": 74,
          "weight": 400,
          "lineHeight": 1.2
        },
        "color": "#695426",
        "align": "center"
      }
    },
    {
      "id": "date-venue",
      "type": "text",
      "name": "Date and Location",
      "position": {
        "x": 140,
        "y": 610
      },
      "size": {
        "width": 470,
        "height": 100
      },
      "zIndex": 2,
      "variable": "event_details",
      "content": {
        "text": "September 15, 2026\nPalace Grand Hall",
        "font": {
          "family": "Manrope",
          "size": 19,
          "weight": 400,
          "lineHeight": 1.2
        },
        "color": "#695426",
        "align": "center"
      }
    },
    {
      "id": "fine-rule",
      "type": "shape",
      "name": "Fine divider",
      "position": {
        "x": 345,
        "y": 723
      },
      "size": {
        "width": 60,
        "height": 1
      },
      "zIndex": 1,
      "content": {
        "shape": "rectangle",
        "fill": "#816a34"
      }
    },
    {
      "id": "invitation-text",
      "type": "text",
      "name": "Invitation Message",
      "position": {
        "x": 140,
        "y": 750
      },
      "size": {
        "width": 470,
        "height": 100
      },
      "zIndex": 2,
      "variable": "message",
      "content": {
        "text": "Request the pleasure of your company\nas we join our lives in marriage.",
        "font": {
          "family": "Cormorant Garamond",
          "size": 23,
          "weight": 400,
          "lineHeight": 1.2
        },
        "color": "#695426",
        "align": "center"
      }
    }
  ],
  "variables": [
    {
      "key": "couple_names",
      "type": "text",
      "label": "Couple Names",
      "defaultValue": "Isabella\n&\nMaximilian",
      "validation": {
        "required": true,
        "maxLength": 50
      }
    },
    {
      "key": "event_details",
      "type": "text",
      "label": "Date and Venue",
      "defaultValue": "September 15, 2026\nPalace Grand Hall",
      "validation": {
        "required": true
      }
    },
    {
      "key": "message",
      "type": "text",
      "label": "Invitation Message",
      "defaultValue": "Request the pleasure of your company\nas we join our lives in marriage.",
      "aiGenerable": true
    }
  ],
  "colorSchemes": [
    {
      "id": "gilded-elegance",
      "name": "Gilded Elegance",
      "colors": {
        "primary": "#816a34",
        "secondary": "#695426",
        "accent": "#816a34",
        "text": "#695426"
      }
    }
  ],
  "settings": {
    "allowMusic": true,
    "allowAnimation": true,
    "rsvpEnabled": true
  }
}
