{
  "id": "3c8b3e51-9a1a-4d42-bd12-fd75a4a5d103",
  "name": "Future / Forward",
  "scene": "business",
  "style": "formal",
  "description": "A focused, cinematic invitation for conferences, launches, and meaningful conversations.",
  "tags": ["professional", "tech", "conference", "video"],
  "thumbnailUrl": "/templates/business-tech/thumbnail.svg",
  "previewUrl": "/templates/business-tech/preview.svg",
  "canvas": {
    "width": 750,
    "height": 1334,
    "background": {
      "type": "video",
      "url": "https://interactive-examples.mdn.mozilla.net/media/cc0-videos/flower.mp4",
      "poster": "/templates/business-tech/poster.svg",
      "loop": true,
      "muted": true
    }
  },
  "layers": [
    { "id": "shade", "type": "shape", "name": "Dark shade", "position": { "x": 0, "y": 0 }, "size": { "width": 750, "height": 1334 }, "content": { "shape": "rectangle", "fill": "rgba(4, 13, 28, 0.62)" }, "locked": true, "zIndex": 1 },
    { "id": "eyebrow", "type": "text", "name": "Event type", "position": { "x": 75, "y": 150 }, "size": { "width": 600, "height": 40 }, "content": { "text": "CARTE PRESENTS / 2026", "font": { "family": "Inter", "size": 16, "weight": 700, "letterSpacing": 3 }, "color": "#86d8ff", "align": "left" }, "zIndex": 2 },
    { "id": "title", "type": "text", "name": "Conference title", "position": { "x": 75, "y": 330 }, "size": { "width": 600, "height": 230 }, "variable": "event_title", "content": { "text": "Future / Forward", "font": { "family": "Inter", "size": 62, "weight": 700, "lineHeight": 1.05 }, "color": "#ffffff", "align": "left", "maxWidth": 600 }, "zIndex": 2 },
    { "id": "host", "type": "text", "name": "Host", "position": { "x": 80, "y": 680 }, "size": { "width": 580, "height": 60 }, "variable": "host_name", "content": { "text": "Hosted by Northstar Studio", "font": { "family": "Inter", "size": 22, "weight": 500 }, "color": "#d6e9f5", "align": "left" }, "zIndex": 2 },
    { "id": "details", "type": "text", "name": "Date and location", "position": { "x": 80, "y": 860 }, "size": { "width": 580, "height": 120 }, "variable": "event_details", "content": { "text": "09 September 2026 / 09:30\nThe Exchange, Manchester", "font": { "family": "Inter", "size": 23, "weight": 500, "lineHeight": 1.6 }, "color": "#ffffff", "align": "left", "maxWidth": 580 }, "zIndex": 2 },
    { "id": "agenda", "type": "text", "name": "Agenda", "position": { "x": 80, "y": 1080 }, "size": { "width": 580, "height": 140 }, "variable": "agenda", "content": { "text": "Talks / Workshops / Open conversation", "font": { "family": "Inter", "size": 19, "weight": 400, "lineHeight": 1.6 }, "color": "#86d8ff", "align": "left", "maxWidth": 580 }, "zIndex": 2 }
  ],
  "variables": [
    { "key": "event_title", "type": "text", "label": "Event title", "defaultValue": "", "validation": { "required": true, "maxLength": 60 }, "aiGenerable": true },
    { "key": "host_name", "type": "text", "label": "Host or company", "defaultValue": "", "validation": { "required": true, "maxLength": 60 } },
    { "key": "event_details", "type": "date", "label": "Date and location", "defaultValue": "", "validation": { "required": true } },
    { "key": "agenda", "type": "text", "label": "Agenda", "defaultValue": "Talks / Workshops / Open conversation" },
    { "key": "host_logo", "type": "image", "label": "Host logo", "defaultValue": "/templates/business-tech/poster.svg" }
  ],
  "colorSchemes": [
    { "id": "signal-blue", "name": "Signal blue", "colors": { "primary": "#86d8ff", "secondary": "#1e5f8d", "accent": "#163c63", "text": "#ffffff", "background": "#040d1c" } },
    { "id": "graphite", "name": "Graphite", "colors": { "primary": "#d6e9f5", "secondary": "#6d7f8c", "accent": "#27343c", "text": "#ffffff", "background": "#121719" } }
  ],
  "settings": { "allowMusic": false, "allowAnimation": true, "rsvpEnabled": true }
}
