{
  "id": "wedding-garden-003",
  "name": "Secret Garden",
  "scene": "wedding",
  "style": "natural",
  "description": "Original secret garden artwork with editable wedding typography on a portrait 2:3 canvas.",
  "tags": [
    "garden",
    "botanical",
    "nature",
    "green",
    "organic"
  ],
  "thumbnailUrl": "/templates/wedding-art/secret-garden-thumbnail.webp",
  "previewUrl": "/templates/wedding-art/secret-garden-preview.webp",
  "canvas": {
    "width": 750,
    "height": 1125,
    "background": {
      "type": "image",
      "url": "/templates/wedding-art/secret-garden.webp",
      "fit": "contain"
    }
  },
  "layers": [
    {
      "id": "invitation-heading",
      "type": "text",
      "name": "Invitation heading",
      "position": {
        "x": 140,
        "y": 230
      },
      "size": {
        "width": 470,
        "height": 36
      },
      "zIndex": 2,
      "content": {
        "text": "Love, in full bloom",
        "font": {
          "family": "Cormorant Garamond",
          "size": 25,
          "weight": 400,
          "lineHeight": 1.2
        },
        "color": "#627252",
        "align": "center"
      }
    },
    {
      "id": "couple-names",
      "type": "text",
      "name": "Couple Names",
      "position": {
        "x": 140,
        "y": 292
      },
      "size": {
        "width": 470,
        "height": 290
      },
      "zIndex": 2,
      "variable": "couple_names",
      "content": {
        "text": "Olivia\n&\nEthan",
        "font": {
          "family": "Cormorant Garamond",
          "size": 74,
          "weight": 400,
          "lineHeight": 1.2
        },
        "color": "#374b38",
        "align": "center"
      }
    },
    {
      "id": "date-venue",
      "type": "text",
      "name": "Date and Location",
      "position": {
        "x": 140,
        "y": 610
      },
      "size": {
        "width": 470,
        "height": 100
      },
      "zIndex": 2,
      "variable": "event_details",
      "content": {
        "text": "May 20, 2026\nBotanical Gardens",
        "font": {
          "family": "Manrope",
          "size": 19,
          "weight": 400,
          "lineHeight": 1.2
        },
        "color": "#374b38",
        "align": "center"
      }
    },
    {
      "id": "fine-rule",
      "type": "shape",
      "name": "Fine divider",
      "position": {
        "x": 345,
        "y": 723
      },
      "size": {
        "width": 60,
        "height": 1
      },
      "zIndex": 1,
      "content": {
        "shape": "rectangle",
        "fill": "#627252"
      }
    },
    {
      "id": "invitation-text",
      "type": "text",
      "name": "Invitation Message",
      "position": {
        "x": 140,
        "y": 750
      },
      "size": {
        "width": 470,
        "height": 100
      },
      "zIndex": 2,
      "variable": "message",
      "content": {
        "text": "Together with our families,\nwe invite you to our wedding celebration.",
        "font": {
          "family": "Cormorant Garamond",
          "size": 23,
          "weight": 400,
          "lineHeight": 1.2
        },
        "color": "#374b38",
        "align": "center"
      }
    }
  ],
  "variables": [
    {
      "key": "couple_names",
      "type": "text",
      "label": "Couple Names",
      "defaultValue": "Olivia\n&\nEthan",
      "validation": {
        "required": true,
        "maxLength": 50
      }
    },
    {
      "key": "event_details",
      "type": "text",
      "label": "Date and Venue",
      "defaultValue": "May 20, 2026\nBotanical Gardens",
      "validation": {
        "required": true
      }
    },
    {
      "key": "message",
      "type": "text",
      "label": "Invitation Message",
      "defaultValue": "Together with our families,\nwe invite you to our wedding celebration.",
      "aiGenerable": true
    }
  ],
  "colorSchemes": [
    {
      "id": "secret-garden",
      "name": "Secret Garden",
      "colors": {
        "primary": "#627252",
        "secondary": "#374b38",
        "accent": "#627252",
        "text": "#374b38"
      }
    }
  ],
  "settings": {
    "allowMusic": true,
    "allowAnimation": true,
    "rsvpEnabled": true
  }
}
